Estado;Nome;Cidade;Endereco
AM; CENTRO DE DOENCAS RENAIS DO AMAZONAS SC LTDA; Manaus - AM;Av. Ayrão - 1046 - Pres. Vargas
AM; CLINICA RENAL DE MANAUS LTDA; Manaus - AM; Av. Castelo Branco - 1709 - Cachoeirinha
AM; FUNDACAO HOSPITAL ADRIANO JORGE;Manaus - AM; Av. Carvalho Leal 1778 - Cachoeirinha
AM; HOSPITAL E PRONTO SOCORRO DR ARISTOTELES PLATAO B DE ARAUJO; Manaus - AM; Av. Autaz Mirim - s/n - Jorge Teixeira
AM; Hospital Beneficente Português; Manaus - AM; Av. Joaquim Nabuco - 1359 - Centro
AM; HOSPITAL SANTA JULIA; Manaus - AM;Av. Alvaro Maia - 510 - Centro
AM; HOSPITAL UNIVERSITARIO GETULIO VARGAS HUGV; Manaus - AM; R. Tomas de Vila Nova - 300 - Centro
AM; PRONEFRO; Manaus - AM; Av. Maceió - 865 - Nossa Sra. das Graças
