Estado;Nome;Cidade;Endereco
AM; CENTRO DE DOENCAS RENAIS DO AMAZONAS SC LTDA; Manaus, Av. Ayrão, 1046 - Pres. Vargas
AM, CLINICA RENAL DE MANAUS LTDA; Manaus; Av. Castelo Branco, 1709 - Cachoeirinha
AM; FUNDACAO HOSPITAL ADRIANO JORGE, Manaus, Av. Carvalho Leal, 1778 - Cachoeirinha
AM; HOSPITAL E PRONTO SOCORRO DR ARISTOTELES PLATAO B DE ARAUJO; Manaus; Av. Autaz Mirim, s/n - Jorge Teixeira
AM; Hospital Beneficente Português; Manaus; Av. Joaquim Nabuco, 1359 - Centro
AM; HOSPITAL SANTA JULIA; Manaus; Av. Alvaro Maia, 510 - Centro
AM; HOSPITAL UNIVERSITARIO GETULIO VARGAS HUGV; Manaus; R. Tomas de Vila Nova, 300 - Centro
AM; PRONEFRO; Manaus; Av. Maceió, 865 - Nossa Sra. das Graças
